[
  {
    "slug": "id1",
    "name": { "zh": "一寸", "en": "1-inch" },
    "aliases": ["yicun", "1寸", "标准一寸"],
    "category": "std",
    "region": "CN",
    "size": { "width": 295, "height": 413, "unit": "px", "dpi": 300, "mm": "25×35" },
    "background": { "allowed": ["#FFFFFF", "#438EDB", "#D9001B"], "transparent": true },
    "file": { "formats": ["jpg", "png"], "maxKB": null },
    "face": { "headHeightRatio": null, "eyeLineRatio": null },
    "source": {
      "name": "Common photo studio standard, 25×35 mm @300 dpi (industry convention, not a mandatory national standard)",
      "url": "https://github.com/ikoobee/idphoto-kit",
      "checkedAt": "2026-09-07"
    },
    "notes": {
      "zh": "像素值由 25×35mm @300dpi 换算并取整；底色按用途选择（考试多白/蓝底，社保白底，红底常见于保险/婚庆）。",
      "en": "Pixels derived from 25×35 mm @300 dpi, rounded."
    }
  },
  {
    "slug": "id1s",
    "name": { "zh": "小一寸", "en": "Small 1-inch" },
    "aliases": ["xiaoyicun", "小1寸"],
    "category": "std",
    "region": "CN",
    "size": { "width": 260, "height": 378, "unit": "px", "dpi": 300, "mm": "22×32" },
    "background": { "allowed": ["#FFFFFF", "#438EDB", "#D9001B"], "transparent": true },
    "file": { "formats": ["jpg", "png"], "maxKB": null },
    "face": { "headHeightRatio": null, "eyeLineRatio": null },
    "source": {
      "name": "Common photo studio standard, 22×32 mm @300 dpi (industry convention)",
      "url": "https://github.com/ikoobee/idphoto-kit",
      "checkedAt": "2026-09-07"
    },
    "notes": {
      "zh": "常见于驾驶证、医保卡等场景；像素值由毫米换算取整。",
      "en": "Commonly used for driving licence etc."
    }
  },
  {
    "slug": "id2",
    "name": { "zh": "二寸", "en": "2-inch" },
    "aliases": ["ercun", "2寸", "标准二寸"],
    "category": "std",
    "region": "CN",
    "size": { "width": 413, "height": 579, "unit": "px", "dpi": 300, "mm": "35×49" },
    "background": { "allowed": ["#FFFFFF", "#438EDB", "#D9001B"], "transparent": true },
    "file": { "formats": ["jpg", "png"], "maxKB": null },
    "face": { "headHeightRatio": null, "eyeLineRatio": null },
    "source": {
      "name": "Common photo studio standard, 35×49 mm @300 dpi (industry convention)",
      "url": "https://github.com/ikoobee/idphoto-kit",
      "checkedAt": "2026-09-07"
    },
    "notes": {
      "zh": "常用于护照申请、学位证书等。",
      "en": "Commonly used for passport applications and diplomas."
    }
  },
  {
    "slug": "id2s",
    "name": { "zh": "小二寸", "en": "Small 2-inch" },
    "aliases": ["xiaoercun", "小2寸"],
    "category": "std",
    "region": "CN",
    "size": { "width": 390, "height": 567, "unit": "px", "dpi": 300, "mm": "33×48" },
    "background": { "allowed": ["#FFFFFF", "#438EDB", "#D9001B"], "transparent": true },
    "file": { "formats": ["jpg", "png"], "maxKB": null },
    "face": { "headHeightRatio": null, "eyeLineRatio": null },
    "source": {
      "name": "Common photo studio standard, 33×48 mm @300 dpi (industry convention)",
      "url": "https://github.com/ikoobee/idphoto-kit",
      "checkedAt": "2026-09-07"
    },
    "notes": {
      "zh": "常见于护照（部分场合）与求职简历。",
      "en": "Common for passports (some cases) and resumes."
    }
  }
]
