[
  {
    "slug": "shebao",
    "name": { "zh": "社会保障卡（二代证数字相片规格）", "en": "Social security card photo" },
    "aliases": ["社保卡", "社保", "医保卡"],
    "category": "cert",
    "region": "CN",
    "size": { "width": 358, "height": 441, "unit": "px", "dpi": 350, "mm": null },
    "background": { "allowed": ["#FFFFFF"], "transparent": false },
    "file": { "formats": ["jpg"], "maxKB": null },
    "face": { "headHeightRatio": null, "eyeLineRatio": null },
    "source": {
      "name": "人社部门社会保障卡数字相片采集要求（沿用二代居民身份证 358×441 数字相片规格）",
      "url": "https://www.mohrss.gov.cn/",
      "checkedAt": "2026-09-09"
    },
    "notes": {
      "zh": "白底免冠彩色数字相片，358×441px（JPG/JPEG）；各地经办渠道细节可能不同，以当地社保经办机构要求为准。",
      "en": "White-background portrait, 358×441 px (JPEG); local offices may vary."
    }
  },
  {
    "slug": "passport-cn",
    "name": {
      "zh": "中华人民共和国护照（电子档・中国领事 APP）",
      "en": "PRC passport photo (digital)"
    },
    "aliases": ["护照", "中国护照", "passport"],
    "category": "cert",
    "region": "CN",
    "size": { "width": 390, "height": 567, "unit": "px", "dpi": 300, "mm": "33×48" },
    "background": { "allowed": ["#FFFFFF"], "transparent": false },
    "file": { "formats": ["jpg"], "maxKB": 80 },
    "face": { "headHeightRatio": [0.58, 0.69], "eyeLineRatio": null },
    "source": {
      "name": "中华人民共和国驻外使领馆《护照/旅行证的照片标准》（33×48mm，头高 28–33mm）",
      "url": "https://au.china-embassy.gov.cn/chn/lsfw/hzlxz/blhzlxzxz/200511/t20051122_983925.htm",
      "checkedAt": "2026-09-09"
    },
    "notes": {
      "zh": "小二寸 33×48mm 白底（或接近白）；头顶距上边沿 3–5mm，头高（下巴至头顶）28–33mm；「中国领事」APP 电子档建议 390×567px、约 30–80KB；纸质办理需同版照片 2 张。",
      "en": "33×48 mm white background; head height 28–33 mm with 3–5 mm top margin; the China Consular APP suggests 390×567 px digital, ~30–80KB; paper applications need 2 identical prints."
    }
  }
]
